experiment	status	pattern	target	before	after	improvement	timestamp	commit
baseline-rfdetr	baseline	-	rfdetr-base.infer()	3.859ms±0.079ms	-	-	2026-04-21T00:00:00	-
rfdetr-exp001	discard	gpu-output-binding	run_session_via_iobinding	3.859ms	3.892ms	-0.9%	2026-04-21T00:10:00	-
rfdetr-exp002	discard	tensor-caching	preproc_image normalization	3.859ms	3.911ms	-1.3%	2026-04-21T00:20:00	-
rfdetr-exp003	keep	pinned-memory	preproc_image H2D transfer	3.859ms	3.846ms	+0.3%	2026-04-21T00:30:00	a09fdff65
baseline-yolov8n	baseline	-	yolov8n-640.infer()	2.528ms±0.107ms	-	-	2026-04-21T01:00:00	-
yolov8n-exp001	keep	pinned-memory	TRT preprocessing H2D transfers	2.528ms	2.347ms	+7.2%	2026-04-21T01:30:00	597699185
